{
  "schema_version": "floor-response-archive/1",
  "case_id": "sample-physical-response",
  "units": {
    "length": "m",
    "time": "s",
    "response": "m/s^2"
  },
  "coordinates": {
    "vertical_axis": "z",
    "handedness": "right"
  },
  "quantity": "vertical_acceleration",
  "normalization": {
    "type": "physical",
    "reference": "FloorModal response field values"
  },
  "node_order": [1, 2, 3, 4, 5, 6, 7, 8, 9],
  "nodes": [
    { "id": 1, "x": 0.0, "y": 0.0, "z": 0.0 },
    { "id": 2, "x": 3.0, "y": 0.0, "z": 0.0 },
    { "id": 3, "x": 6.0, "y": 0.0, "z": 0.0 },
    { "id": 4, "x": 0.0, "y": 2.0, "z": 0.0 },
    { "id": 5, "x": 3.0, "y": 2.0, "z": 0.0 },
    { "id": 6, "x": 6.0, "y": 2.0, "z": 0.0 },
    { "id": 7, "x": 0.0, "y": 4.0, "z": 0.0 },
    { "id": 8, "x": 3.0, "y": 4.0, "z": 0.0 },
    { "id": 9, "x": 6.0, "y": 4.0, "z": 0.0 }
  ],
  "faces": [
    { "id": 1, "node_ids": [1, 2, 5, 4] },
    { "id": 2, "node_ids": [2, 3, 6, 5] },
    { "id": 3, "node_ids": [4, 5, 8, 7] },
    { "id": 4, "node_ids": [5, 6, 9, 8] }
  ],
  "time_s": [0.0, 0.05, 0.1, 0.15, 0.2],
  "response_values": [
    [0.0, 0.0, 0.0, 0.0, 0.0, 0.0, 0.0, 0.0, 0.0],
    [0.0, 0.018, 0.0, 0.012, 0.082, 0.016, 0.0, 0.014, 0.0],
    [0.0, -0.024, 0.0, -0.016, -0.11, -0.021, 0.0, -0.018, 0.0],
    [0.0, 0.011, 0.0, 0.008, 0.047, 0.01, 0.0, 0.009, 0.0],
    [0.0, 0.0, 0.0, 0.0, 0.0, 0.0, 0.0, 0.0, 0.0]
  ],
  "provenance": {
    "producer": "FloorModal",
    "producer_schema": "viewer-contract-prototype/1",
    "evaluation_profile": "internal-screening/1",
    "note": "Synthetic values for viewer contract and rendering regression only"
  }
}
